[
  {
    "actor_ref": "actor:coordinator",
    "authority": "NONE",
    "base_revision": "c7a4b16b22ff3551802182577953681749a782bd",
    "blocker_code": null,
    "budget": {
      "max_model_calls": 48,
      "max_repair_loops": 1,
      "max_turns": 48,
      "max_usage_units": 800.0,
      "max_wall_seconds": 1800
    },
    "candidate_revision": null,
    "event_id": "evt-84665e50-fa34-410b-8668-18706b262382",
    "executor_ref": "executor:claude-code",
    "expected_output_schema": "sovereign.sscm-implementer-result.v0.1",
    "input_refs": [],
    "mission_id": "mission-sscm-01c-live-1",
    "observed_at": "2026-09-07T18:01:38.159Z",
    "output_refs": [
      {
        "kind": "FILE",
        "ref": "run:mission-sscm-01c-live-1:artifacts/coordinator-instruction.json",
        "sha256": "69380ee7159e62a8e1f38e8f44db798c65405ce77947071495504106e76a1fc8"
      },
      {
        "kind": "RECEIPT",
        "ref": "run:mission-sscm-01c-live-1:artifacts/coordinator-run.json",
        "sha256": "7068b00651b09c4fadda06fef72556b57d13a0949a6f35189e7d2656c020129b"
      }
    ],
    "predecessor_event_ids": [],
    "schema_version": "sovereign.a2a-collaboration-event.v0.2",
    "session_ref": "1b4530e2-c4d8-40c8-af53-cf81409e3937",
    "status": "PENDING",
    "target_role": "IMPLEMENTER",
    "task_id": "task:implement",
    "verb": "PUBLISH",
    "workspace_ref": null
  },
  {
    "actor_ref": "actor:implementer-1",
    "authority": "NONE",
    "base_revision": "c7a4b16b22ff3551802182577953681749a782bd",
    "blocker_code": null,
    "budget": {
      "max_model_calls": 48,
      "max_repair_loops": 1,
      "max_turns": 48,
      "max_usage_units": 800.0,
      "max_wall_seconds": 1800
    },
    "candidate_revision": null,
    "event_id": "evt-9e6e09cf-64d9-437e-803b-65f47775a0a9",
    "executor_ref": "executor:codex",
    "expected_output_schema": null,
    "input_refs": [
      {
        "kind": "FILE",
        "ref": "run:mission-sscm-01c-live-1:artifacts/coordinator-instruction.json",
        "sha256": "69380ee7159e62a8e1f38e8f44db798c65405ce77947071495504106e76a1fc8"
      }
    ],
    "mission_id": "mission-sscm-01c-live-1",
    "observed_at": "2026-09-07T18:01:38.540Z",
    "output_refs": [],
    "predecessor_event_ids": [
      "evt-84665e50-fa34-410b-8668-18706b262382"
    ],
    "schema_version": "sovereign.a2a-collaboration-event.v0.2",
    "session_ref": null,
    "status": "ACTIVE",
    "target_role": "IMPLEMENTER",
    "task_id": "task:implement",
    "verb": "CLAIM",
    "workspace_ref": "/home/kowen9024/sovereign/.sovereign/runs/mission-sscm-01c-live-1/workspaces/implementer-1-wt"
  },
  {
    "actor_ref": "actor:implementer",
    "authority": "NONE",
    "base_revision": "c7a4b16b22ff3551802182577953681749a782bd",
    "blocker_code": null,
    "budget": {
      "max_model_calls": 48,
      "max_repair_loops": 1,
      "max_turns": 48,
      "max_usage_units": 800.0,
      "max_wall_seconds": 1800
    },
    "candidate_revision": "6edb3a2ac4dd1ce7a2595fe47c5ba8d8c7a47f21",
    "event_id": "evt-b1574bbf-6d72-4094-820d-bab0a2c1a3a2",
    "executor_ref": "executor:codex",
    "expected_output_schema": null,
    "input_refs": [
      {
        "kind": "FILE",
        "ref": "run:mission-sscm-01c-live-1:artifacts/coordinator-instruction.json",
        "sha256": "69380ee7159e62a8e1f38e8f44db798c65405ce77947071495504106e76a1fc8"
      }
    ],
    "mission_id": "mission-sscm-01c-live-1",
    "observed_at": "2026-09-07T18:10:19.171Z",
    "output_refs": [
      {
        "kind": "FILE",
        "ref": "run:mission-sscm-01c-live-1:artifacts/implementer-result.json",
        "sha256": "8df99af06592bc0710ff585d3a5ce5d98138e427c29d4ab6ba4c91b3bcde3f64"
      },
      {
        "kind": "RECEIPT",
        "ref": "run:mission-sscm-01c-live-1:artifacts/implementer-run.json",
        "sha256": "d1c260a52a62de0f06d1caffab9a6ff2f94c9b9581f9b7cdb8f4f1e0942a85e2"
      }
    ],
    "predecessor_event_ids": [
      "evt-9e6e09cf-64d9-437e-803b-65f47775a0a9"
    ],
    "schema_version": "sovereign.a2a-collaboration-event.v0.2",
    "session_ref": "codex-thread:01a07d08-6b45-7232-aa0d-fdf332993f97",
    "status": "SUCCEEDED",
    "target_role": null,
    "task_id": "task:implement",
    "verb": "COMPLETE",
    "workspace_ref": "/home/kowen9024/sovereign/.sovereign/runs/mission-sscm-01c-live-1/workspaces/implementer-1-wt"
  },
  {
    "actor_ref": "host:sscm-mission-controller",
    "authority": "NONE",
    "base_revision": "c7a4b16b22ff3551802182577953681749a782bd",
    "blocker_code": null,
    "budget": {
      "max_model_calls": 48,
      "max_repair_loops": 1,
      "max_turns": 48,
      "max_usage_units": 800.0,
      "max_wall_seconds": 1800
    },
    "candidate_revision": "6edb3a2ac4dd1ce7a2595fe47c5ba8d8c7a47f21",
    "event_id": "evt-0b623960-a2a3-4ecf-bce9-38c37d2df57f",
    "executor_ref": null,
    "expected_output_schema": null,
    "input_refs": [],
    "mission_id": "mission-sscm-01c-live-1",
    "observed_at": "2026-09-07T18:10:19.224Z",
    "output_refs": [
      {
        "kind": "FILE",
        "ref": "run:mission-sscm-01c-live-1:artifacts/host-verification-candidate-1.json",
        "sha256": "fd5ec3c751760ca1f31438e55e4424d11e2d6bb416d8c4225e725b9ef471d455"
      },
      {
        "kind": "REVISION",
        "ref": "git:6edb3a2ac4dd1ce7a2595fe47c5ba8d8c7a47f21",
        "sha256": null
      }
    ],
    "predecessor_event_ids": [
      "evt-b1574bbf-6d72-4094-820d-bab0a2c1a3a2"
    ],
    "schema_version": "sovereign.a2a-collaboration-event.v0.2",
    "session_ref": null,
    "status": "SUCCEEDED",
    "target_role": null,
    "task_id": "task:implement",
    "verb": "OBSERVE",
    "workspace_ref": "/home/kowen9024/sovereign/.sovereign/runs/mission-sscm-01c-live-1/workspaces/implementer-1-wt"
  },
  {
    "actor_ref": "evaluator:sscm-holdout-v0.1",
    "authority": "NONE",
    "base_revision": "c7a4b16b22ff3551802182577953681749a782bd",
    "blocker_code": "EVALUATION_FAIL",
    "budget": {
      "max_model_calls": 48,
      "max_repair_loops": 1,
      "max_turns": 48,
      "max_usage_units": 800.0,
      "max_wall_seconds": 1800
    },
    "candidate_revision": "6edb3a2ac4dd1ce7a2595fe47c5ba8d8c7a47f21",
    "event_id": "evt-5168f63d-0adc-48d3-b3ec-34a1badf5054",
    "executor_ref": null,
    "expected_output_schema": null,
    "input_refs": [
      {
        "kind": "REVISION",
        "ref": "git:6edb3a2ac4dd1ce7a2595fe47c5ba8d8c7a47f21",
        "sha256": null
      }
    ],
    "mission_id": "mission-sscm-01c-live-1",
    "observed_at": "2026-09-07T18:10:19.570Z",
    "output_refs": [
      {
        "kind": "TEST_RESULT",
        "ref": "run:mission-sscm-01c-live-1:artifacts/evaluation-1.json",
        "sha256": "17ae6f3b26d4452b0e3f631741e071f80a80270a7b792825bf8fe5cc0ce0dc54"
      },
      {
        "kind": "RECEIPT",
        "ref": "run:mission-sscm-01c-live-1:artifacts/evaluation-1-receipt.json",
        "sha256": "c64be5fc226a354cb8f249ff30667f47bc08cb9a23bb70047362827e89be77c7"
      }
    ],
    "predecessor_event_ids": [
      "evt-0b623960-a2a3-4ecf-bce9-38c37d2df57f"
    ],
    "schema_version": "sovereign.a2a-collaboration-event.v0.2",
    "session_ref": null,
    "status": "FAILED",
    "target_role": null,
    "task_id": "task:implement",
    "verb": "REJECT",
    "workspace_ref": null
  },
  {
    "actor_ref": "host:sscm-mission-controller",
    "authority": "NONE",
    "base_revision": "c7a4b16b22ff3551802182577953681749a782bd",
    "blocker_code": null,
    "budget": {
      "max_model_calls": 48,
      "max_repair_loops": 1,
      "max_turns": 48,
      "max_usage_units": 800.0,
      "max_wall_seconds": 1800
    },
    "candidate_revision": "6edb3a2ac4dd1ce7a2595fe47c5ba8d8c7a47f21",
    "event_id": "evt-0c442ed4-aa42-406a-988a-230350c4be1d",
    "executor_ref": null,
    "expected_output_schema": null,
    "input_refs": [
      {
        "kind": "TEST_RESULT",
        "ref": "run:mission-sscm-01c-live-1:artifacts/evaluation-1.json",
        "sha256": "17ae6f3b26d4452b0e3f631741e071f80a80270a7b792825bf8fe5cc0ce0dc54"
      }
    ],
    "mission_id": "mission-sscm-01c-live-1",
    "observed_at": "2026-09-07T18:10:19.737Z",
    "output_refs": [
      {
        "kind": "FILE",
        "ref": "run:mission-sscm-01c-live-1:artifacts/repair-instruction.json",
        "sha256": "1940a967020c327bcd4939f642ac95d6676131ce588090f97a73d2918341abfe"
      }
    ],
    "predecessor_event_ids": [
      "evt-5168f63d-0adc-48d3-b3ec-34a1badf5054"
    ],
    "schema_version": "sovereign.a2a-collaboration-event.v0.2",
    "session_ref": null,
    "status": "PENDING",
    "target_role": null,
    "task_id": "task:implement",
    "verb": "RETRY",
    "workspace_ref": null
  },
  {
    "actor_ref": "actor:implementer-2",
    "authority": "NONE",
    "base_revision": "6edb3a2ac4dd1ce7a2595fe47c5ba8d8c7a47f21",
    "blocker_code": null,
    "budget": {
      "max_model_calls": 48,
      "max_repair_loops": 1,
      "max_turns": 48,
      "max_usage_units": 800.0,
      "max_wall_seconds": 1800
    },
    "candidate_revision": null,
    "event_id": "evt-426ad2f1-372b-418d-8d68-c61884902a6a",
    "executor_ref": "executor:codex",
    "expected_output_schema": null,
    "input_refs": [
      {
        "kind": "FILE",
        "ref": "run:mission-sscm-01c-live-1:artifacts/repair-instruction.json",
        "sha256": "1940a967020c327bcd4939f642ac95d6676131ce588090f97a73d2918341abfe"
      }
    ],
    "mission_id": "mission-sscm-01c-live-1",
    "observed_at": "2026-09-07T18:10:20.412Z",
    "output_refs": [],
    "predecessor_event_ids": [
      "evt-0c442ed4-aa42-406a-988a-230350c4be1d"
    ],
    "schema_version": "sovereign.a2a-collaboration-event.v0.2",
    "session_ref": null,
    "status": "ACTIVE",
    "target_role": "REPAIR_IMPLEMENTER",
    "task_id": "task:implement",
    "verb": "CLAIM",